{
  "_comment": "Reference shape — what the SKILL fallback should produce. Sync with manifest-from-populated.json on edit.",
  "version": "2",
  "generated_at": "2026-06-13T00:00:00.000Z",
  "generator": "brand-extract-skill@0.4.0",
  "tier": "standard",
  "files": {
    "overview.md": {
      "status": "complete",
      "bytes": 244
    },
    "voice.md": {
      "status": "complete",
      "bytes": 146
    },
    "tokens/colors.md": {
      "status": "complete",
      "bytes": 143
    },
    "tokens/typography.md": {
      "status": "complete",
      "bytes": 218
    },
    "tokens/spacing.md": {
      "status": "complete",
      "bytes": 167
    },
    "tokens/motion.md": {
      "status": "complete",
      "bytes": 182
    },
    "tokens/surfaces.md": {
      "status": "complete",
      "bytes": 169
    },
    "composition/page-types.md": {
      "status": "complete",
      "bytes": 90
    },
    "composition/patterns.md": {
      "status": "complete",
      "bytes": 112
    },
    "composition/anti-patterns.md": {
      "status": "complete",
      "bytes": 104
    },
    "conflicts.md": {
      "status": "complete",
      "bytes": 136
    },
    "CHANGELOG.md": {
      "status": "complete",
      "bytes": 89
    }
  },
  "stages": {
    "1_figma": {
      "ran": false,
      "reason": "skipped: sources.figma unset",
      "fallback_decision": "SKIP",
      "chain_entry_used": null,
      "required_dependencies": [
        "figma-console"
      ],
      "available_dependencies": []
    },
    "2_web": {
      "ran": true,
      "wrote": [
        "tokens/colors.md",
        "tokens/typography.md",
        "tokens/spacing.md",
        "tokens/surfaces.md"
      ],
      "confidence": "MEDIUM",
      "fallback_decision": "none",
      "chain_entry_used": {
        "kind": "mcp",
        "name": "playwright",
        "quality_label": "full"
      },
      "required_dependencies": [
        "playwright"
      ],
      "available_dependencies": [
        "playwright"
      ]
    },
    "3_voice": {
      "ran": true,
      "wrote": [
        "voice.md"
      ],
      "samples": 14,
      "confidence": "MEDIUM",
      "fallback_decision": "none",
      "chain_entry_used": {
        "kind": "mcp",
        "name": "playwright",
        "quality_label": "full"
      },
      "required_dependencies": [
        "playwright"
      ],
      "available_dependencies": [
        "playwright",
        "jina-reader",
        "webfetch"
      ]
    },
    "4_overview": {
      "ran": true,
      "wrote": [
        "overview.md"
      ],
      "sources": [
        "pdf:brand-guide.pdf"
      ],
      "fallback_decision": "none",
      "chain_entry_used": {
        "kind": "native_tool",
        "name": "read",
        "quality_label": "full"
      },
      "required_dependencies": [],
      "available_dependencies": [
        "read"
      ]
    },
    "5_conflicts": {
      "ran": true,
      "wrote": [
        "conflicts.md"
      ],
      "active": 0,
      "fallback_decision": "none",
      "chain_entry_used": {
        "kind": "native_tool",
        "name": "read",
        "quality_label": "full"
      },
      "required_dependencies": [],
      "available_dependencies": [
        "read"
      ]
    },
    "6_components": {
      "ran": false,
      "reason": "skipped: tier != comprehensive",
      "fallback_decision": "SKIP",
      "chain_entry_used": null,
      "required_dependencies": [],
      "available_dependencies": [
        "read"
      ]
    },
    "8_brand_md": {
      "ran": true,
      "wrote": [
        "../brand.md",
        "../design.md"
      ],
      "fallback_decision": "none",
      "chain_entry_used": {
        "kind": "native_tool",
        "name": "read",
        "quality_label": "full"
      },
      "required_dependencies": [],
      "available_dependencies": [
        "read"
      ]
    }
  },
  "dependencies": {
    "figma-console": {
      "kind": "mcp",
      "available": false,
      "used_by": []
    },
    "playwright": {
      "kind": "mcp",
      "available": true,
      "used_by": [
        "2_web",
        "3_voice"
      ]
    },
    "jina-reader": {
      "kind": "http",
      "available": true,
      "used_by": []
    },
    "dtcg-tokens-file": {
      "kind": "user_artifact",
      "available": false,
      "used_by": [],
      "expected_path_glob": "assets/*.tokens.json"
    },
    "webfetch": {
      "kind": "native_tool",
      "available": true,
      "used_by": []
    },
    "read": {
      "kind": "native_tool",
      "available": true,
      "used_by": [
        "4_overview",
        "5_conflicts",
        "8_brand_md"
      ]
    }
  },
  "client": "acme"
}
